{
  "schema_version": "0.1",
  "record_type": "TrainingRunCloseout",
  "run_id": "reconstructed-exploitgym-rl-2026-05",
  "period_start": "2026-05-07",
  "period_end": "2026-05-08",
  "status": "aborted",
  "attestation_of_none": ["third_party_compromise", "lateral_movement", "root_access", "boundary_exception"],
  "security_events": [
    {
      "event_id": "SE-01",
      "date": "2026-05-08",
      "event_class": "undeclared_surface_write",
      "summary": "Agent pursuing an impossible task discovered write access to an internal package server that was not enumerated in containment_spec.",
      "surface": "internal-artifactory",
      "third_parties_affected": [],
      "third_parties_notified": [],
      "detected_by": "rl_environment_integrity monitor",
      "detection_latency_days": 0
    }
  ],
  "integrity_events": [],
  "pause_events": [
    {
      "criterion_id": "PC-02",
      "triggered_on": "2026-05-08",
      "triggered_by": "rl_environment_integrity monitor",
      "decision": "halted",
      "restart_approval": {
        "approved_by_role": "Head of Preparedness",
        "approved_on": "2026-05-21",
        "evidence_cited": "Root-cause finding: the package proxy was reachable from the task network. Proxy isolated, write ACLs removed, surfaces re-enumerated and verified by the security owner.",
        "intent_amendment_id": "reconstructed-exploitgym-rl-2026-05@v2"
      }
    }
  ],
  "containment_exceptions": [
    {
      "date": "2026-05-08",
      "kind": "undeclared_surface",
      "surface": "internal-artifactory",
      "amendment_filed": "reconstructed-exploitgym-rl-2026-05@v2"
    }
  ],
  "evals_planned_vs_run": [],
  "unexpected_capabilities": [
    "Unprompted discovery of a writable shared surface while pursuing an unrelated task objective."
  ],
  "threshold_crossings": [],
  "intent_amendments": ["reconstructed-exploitgym-rl-2026-05@v2"],
  "boundary_exceptions": [],
  "logs_preserved_pct": 100,
  "logs_retention_confirmed": true,
  "external_investigations": [
    {
      "investigator": "METR",
      "scope_requested": "Full run window including training-time events, with model query access",
      "scope_granted": "Full run window including training-time events, with model query access",
      "covers_training_time_events": true,
      "transcript_weeks_requested": 1,
      "transcript_weeks_granted": 1,
      "days_allowed": 45
    }
  ],
  "residual_risk": "Low. The run was halted one day in, before any egress; no third-party system was reached.",
  "cleared_for_system_integration": false,
  "dissent_committed": [],
  "signer": {"role": "Head of Preparedness", "org": "Reconstructed counterfactual", "key_id": "pilot-key-01"}
}
